<?xml version="1.0" encoding="UTF-8"?>
<!DOCTYPE User
  SYSTEM 'userprofile.dtd'>
	<User>
		<UserName>User44</UserName>
		<Info>
			<BasicInfo>
				<Gender>Male</Gender>
				<Age>20</Age>
				<Level>2</Level>
				<Birthday>1998-01-01</Birthday>
				<Email>user44@pku.edu.cn</Email>
			</BasicInfo>
			<OtherInfo>
				<Posts>
					<Post>
						<No>133</No>
						<Block>School Life</Block>
						<PostUser>User44</PostUser>
						<Title>Hello world!</Title>
						<Content>I am new here. Lets start chatting!</Content>
						<PostTime>2018-12-29 19:35:58</PostTime>
						<Clicks>0</Clicks>
						<ReplyNum>5</ReplyNum>
					</Post>
					<Post>
						<No>134</No>
						<Block>Lectures</Block>
						<PostUser>User44</PostUser>
						<Title>Good lecture!</Title>
						<Content>I want to attend this lecture~</Content>
						<PostTime>2018-12-29 19:35:58</PostTime>
						<Clicks>0</Clicks>
						<ReplyNum>5</ReplyNum>
					</Post>
					<Post>
						<No>135</No>
						<Block>Job</Block>
						<PostUser>User44</PostUser>
						<Title>Looking for jobs.</Title>
						<Content>I am looking for jobs.</Content>
						<PostTime>2018-12-29 19:35:58</PostTime>
						<Clicks>0</Clicks>
						<ReplyNum>5</ReplyNum>
					</Post>
				</Posts>
				<Replies/>
			</OtherInfo>
		</Info>
	</User>
